Lyrics	Transliteration	Direct Translation	Poetic Translation
–…‚Æ‰ä‚Æ	imo to are to	my little sister and I	Little Sister and I
‚¢‚é‚³‚ÌR‚Ì	irusanoyama no	are on the mountain	On the mountain
R—–	yamararagi	the mountain orchid	Among orchid blooms:
è‚Èæ‚èG‚ê‚»‚â	te na tori fure soya	take and touch it with your hand	Take and touch them with gentle hands;
–e‚Ü‚³‚é‚ª‚É‚â	kao masaruga ni ya	its form is growing	"Their tender beauty is growing,"
¾‚­‚Ü‚³‚é‚ª‚É‚â	toku masaruga ni ya	quickly growing	Their bloom too quickly is growing.
			
Anonymous	"Markham, Elizabeth. Saibara: Japanese Court Songs of the Heian Period. Vol. 2. Cambridge: Cambridge UP, 1983. Print. "	Carol Anne Perry Lagemann	Carol Anne Perry Lagemann
